maṇḍala,sūkta,ṛca,paṅktī,index,IAST,Griffith,Devanāgarī,m-s-r,pada pāṭha,
5,44,10,a,5-44-10-A,sa hi kṣatrasya manasasya cittibhir evāvadasya yajatasya sadhreḥ,"For it is he: with though to of Ksatra, Manasa, of Yajata, and Sadhri, and Evavada,",स हि क्षत्रस्य मनसस्य चित्तिभिरेवावदस्य यजतस्य सध्रेः,5-44-10,saḥ | hi | kṣatrasya | manasasya | citti-bhiḥ | eva-vadasya | yajatasya | sadhreḥ || ava-tsārasya | spr̥ṇavāma | raṇva-bhiḥ | śaviṣṭham | vājam | viduṣā | cit | ardhyam ||5.44.10||,
5,44,10,b,5-44-10-B,avatsārasya spṛṇavāma raṇvabhiḥ śaviṣṭhaṁ vājaṁ viduṣā cid ardhyam,With Avatsara's sweet songs will we strive to win the mightiest strength which even he who knows should,अवत्सारस्य स्पृणवाम रण्वभिः शविष्ठं वाजं विदुषा चिदर्ध्यम्,5-44-10,saḥ | hi | kṣatrasya | manasasya | citti-bhiḥ | eva-vadasya | yajatasya | sadhreḥ || ava-tsārasya | spr̥ṇavāma | raṇva-bhiḥ | śaviṣṭham | vājam | viduṣā | cit | ardhyam ||5.44.10||,
5,44,11,a,5-44-11-A,śyena āsām aditiḥ kakṣyo mado viśvavārasya yajatasya māyinaḥ,"The Hawk is their full source, girth-stretching rapturous drink of Visvavara, of Mayin, and Yajata.",श्येन आसामदितिः कक्ष्यो मदो विश्ववारस्य यजतस्य मायिनः,5-44-11,śyenaḥ | āsām | aditiḥ | kakṣyaḥ | madaḥ | viśva-vārasya | yajatasya | māyinaḥ || sam | anyam-anyam | arthayanti | etave | viduḥ | vi-sāṇam | pari-pānam | anti | te ||5.44.11||,
5,44,11,b,5-44-11-B,sam anyam-anyam arthayanty etave vidur viṣāṇam paripānam anti te,"They ever seek a fresh draught so that they may come, know when thy time to halt and drink thy fill is",समन्यमन्यमर्थयन्त्येतवे विदुर्विषाणं परिपानमन्ति ते,5-44-11,śyenaḥ | āsām | aditiḥ | kakṣyaḥ | madaḥ | viśva-vārasya | yajatasya | māyinaḥ || sam | anyam-anyam | arthayanti | etave | viduḥ | vi-sāṇam | pari-pānam | anti | te ||5.44.11||,
5,44,12,a,5-44-12-A,sadāpṛṇo yajato vi dviṣo vadhīd bāhuvṛktaḥ śrutavit taryo vaḥ sacā,"Sadaprna the holy, Tarya, Srutavit, and Bahuvrkta, joined with you, have slain the foes.",सदापृणो यजतो वि द्विषो वधीद्बाहुवृक्तः श्रुतवित्तर्यो वः सचा,5-44-12,sadā-pr̥ṇaḥ | yajataḥ | vi | dviṣaḥ | vadhīt | bāhu-vr̥ktaḥ | śruta-vit | taryaḥ | vaḥ | sacā || ubhā | saḥ | varā | prati | eti | bhāti | ca | yat | īm | gaṇam | bhajate | suprayāva-bhiḥ ||5.44.12||,
5,44,12,b,5-44-12-B,ubhā sa varā praty eti bhāti ca yad īṁ gaṇam bhajate suprayāvabhiḥ,He gains his wish in both the worlds and brightly shines-when he adores the host with well-advancing ste,उभा स वरा प्रत्येति भाति च यदीं गणं भजते सुप्रयावभिः,5-44-12,sadā-pr̥ṇaḥ | yajataḥ | vi | dviṣaḥ | vadhīt | bāhu-vr̥ktaḥ | śruta-vit | taryaḥ | vaḥ | sacā || ubhā | saḥ | varā | prati | eti | bhāti | ca | yat | īm | gaṇam | bhajate | suprayāva-bhiḥ ||5.44.12||,
5,44,13,a,5-44-13-A,sutambharo yajamānasya satpatir viśvāsām ūdhaḥ sa dhiyām udañcanaḥ,"The worshipper's defender is Sutambhara, producer and uplifter of all holy thoughts.",सुतम्भरो यजमानस्य सत्पतिर्विश्वासामूधः स धियामुदञ्चनः,5-44-13,sutam-bharaḥ | yajamānasya | sat-patiḥ | viśvāsām | ūdhaḥ | saḥ | dhiyām | ut-añcanaḥ || bharat | dhenuḥ | rasa-vat | śiśriye | payaḥ | anu-bruvāṇaḥ | adhi | eti | na | svapan ||5.44.13||,
5,44,13,b,5-44-13-B,bharad dhenū rasavac chiśriye payo 'nubruvāṇo adhy eti na svapan,"The milch-cow brought, sweet-flavoured milk was dealt around. Who speaks the bidding text knows this, no",भरद्धेनू रसवच्छिश्रिये पयोऽनुब्रुवाणो अध्येति न स्वपन्,5-44-13,sutam-bharaḥ | yajamānasya | sat-patiḥ | viśvāsām | ūdhaḥ | saḥ | dhiyām | ut-añcanaḥ || bharat | dhenuḥ | rasa-vat | śiśriye | payaḥ | anu-bruvāṇaḥ | adhi | eti | na | svapan ||5.44.13||,
5,44,14,a,5-44-14-A,yo jāgāra tam ṛcaḥ kāmayante yo jāgāra tam u sāmāni yanti,The sacred hymns love him who wakes and watches: to him who watches come the Sama verses.,यो जागार तमृचः कामयन्ते यो जागार तमु सामानि यन्ति,5-44-14,yaḥ | jāgāra | tam | r̥caḥ | kāmayante | yaḥ | jāgāra | tam | ūm̐ iti | sāmāni | yanti || yaḥ | jāgāra | tam | ayam | somaḥ | āha | tava | aham | asmi | sakhye | ni-okāḥ ||5.44.14||,
5,44,14,b,5-44-14-B,yo jāgāra tam ayaṁ soma āha tavāham asmi sakhye nyokāḥ,"This Soma saith unto the man who watches, I rest and have my dwelling in thy friendship.",यो जागार तमयं सोम आह तवाहमस्मि सख्ये न्योकाः,5-44-14,yaḥ | jāgāra | tam | r̥caḥ | kāmayante | yaḥ | jāgāra | tam | ūm̐ iti | sāmāni | yanti || yaḥ | jāgāra | tam | ayam | somaḥ | āha | tava | aham | asmi | sakhye | ni-okāḥ ||5.44.14||,
5,44,15,a,5-44-15-A,agnir jāgāra tam ṛcaḥ kāmayante 'gnir jāgāra tam u sāmāni yanti,"Agni is watchful, and the gcas love him; Agni is watchful, Sama verses seek him.",अग्निर्जागार तमृचः कामयन्तेऽग्निर्जागार तमु सामानि यन्ति,5-44-15,agniḥ | jāgāra | tam | r̥caḥ | kāmayante | agniḥ | jāgāra | tam | ūm̐ iti | sāmāni | yanti || agniḥ | jāgāra | tam | ayam | somaḥ | āha | tava | aham | asmi | sakhye | ni-okāḥ ||5.44.15||,
5,44,15,b,5-44-15-B,agnir jāgāra tam ayaṁ soma āha tavāham asmi sakhye nyokāḥ,"Agni is watchful, to him saith this Soma, I rest and have my dwelling in thy friendship.",अग्निर्जागार तमयं सोम आह तवाहमस्मि सख्ये न्योकाः,5-44-15,agniḥ | jāgāra | tam | r̥caḥ | kāmayante | agniḥ | jāgāra | tam | ūm̐ iti | sāmāni | yanti || agniḥ | jāgāra | tam | ayam | somaḥ | āha | tava | aham | asmi | sakhye | ni-okāḥ ||5.44.15||,
5,45,1,a,5-45-1-A,vidā divo viṣyann adrim ukthair āyatyā uṣaso arcino guḥ,BARDS of approaching Dawn who know the heavens are come with hymns to throw the mountain open.,विदा दिवो विष्यन्नद्रिमुक्थैरायत्या उषसो अर्चिनो गुः,5-45-1,vidāḥ | divaḥ | vi-syan | adrim | ukthaiḥ | ā-yatyāḥ | uṣasaḥ | arcinaḥ | guḥ || apa | avr̥ta | vrajinīḥ | ut | svaḥ | gāt | vi | duraḥ | mānuṣīḥ | devaḥ | āvarityāvaḥ ||5.45.1||,
5,45,1,b,5-45-1-B,apāvṛta vrajinīr ut svar gād vi duro mānuṣīr deva āvaḥ,"The Sun hath risen and oped the stable portals: the doors of men, too, hath the God thrown open.",अपावृत व्रजिनीरुत्स्वर्गाद्वि दुरो मानुषीर्देव आवः,5-45-1,vidāḥ | divaḥ | vi-syan | adrim | ukthaiḥ | ā-yatyāḥ | uṣasaḥ | arcinaḥ | guḥ || apa | avr̥ta | vrajinīḥ | ut | svaḥ | gāt | vi | duraḥ | mānuṣīḥ | devaḥ | āvarityāvaḥ ||5.45.1||,
5,45,2,a,5-45-2-A,vi sūryo amatiṁ na śriyaṁ sād orvād gavām mātā jānatī gāt,"Surya hath spread his light as splendour: hither came the Cows' Mother, conscious, from the stable,",वि सूर्यो अमतिं न श्रियं सादोर्वाद्गवां माता जानती गात्,5-45-2,vi | sūryaḥ | amatim | na | śriyam | sāt | ā | ūrvāt | gavām | mātā | jānatī | gāt || dhanva-arṇasaḥ | nadyaḥ | khādaḥ-arṇāḥ | sthūṇā-iva | su-mitā | dr̥ṁhata | dyauḥ ||5.45.2||,
5,45,2,b,5-45-2-B,dhanvarṇaso nadyaḥ khādoarṇāḥ sthūṇeva sumitā dṛṁhata dyauḥ,To streams that flow with biting waves to deserts; and heaven is stablished like a firm-set pillar.,धन्वर्णसो नद्यः खादोअर्णाः स्थूणेव सुमिता दृंहत द्यौः,5-45-2,vi | sūryaḥ | amatim | na | śriyam | sāt | ā | ūrvāt | gavām | mātā | jānatī | gāt || dhanva-arṇasaḥ | nadyaḥ | khādaḥ-arṇāḥ | sthūṇā-iva | su-mitā | dr̥ṁhata | dyauḥ ||5.45.2||,
5,45,3,a,5-45-3-A,asmā ukthāya parvatasya garbho mahīnāṁ januṣe pūrvyāya,This laud hath won the burden of the mountain. To aid the ancient birth of mighty waters,अस्मा उक्थाय पर्वतस्य गर्भो महीनां जनुषे पूर्व्याय,5-45-3,asmai | ukthāya | parvatasya | garbhaḥ | mahīnām | januṣe | pūrvyāya || vi | parvataḥ | jihīta | sādhata | dyauḥ | ā-vivāsantaḥ | dasayanta | bhūma ||5.45.3||,
5,45,3,b,5-45-3-B,vi parvato jihīta sādhata dyaur āvivāsanto dasayanta bhūma,"The mountain parted, Heaven performed his office. The worshippers were worn with constant serving.",वि पर्वतो जिहीत साधत द्यौराविवासन्तो दसयन्त भूम,5-45-3,asmai | ukthāya | parvatasya | garbhaḥ | mahīnām | januṣe | pūrvyāya || vi | parvataḥ | jihīta | sādhata | dyauḥ | ā-vivāsantaḥ | dasayanta | bhūma ||5.45.3||,
5,45,4,a,5-45-4-A,sūktebhir vo vacobhir devajuṣṭair indrā nv agnī avase huvadhyai,"With hymns and God-loved words will I invoke you, Indra and Agni, to obtain your favour,",सूक्तेभिर्वो वचोभिर्देवजुष्टैरिन्द्रा न्वग्नी अवसे हुवध्यै,5-45-4,su-uktebhiḥ | vaḥ | vacaḥ-bhiḥ | deva-juṣṭaiḥ | indrā | nu | agnī iti | avase | huvadhyai || ukthebhiḥ | hi | sma | kavayaḥ | su-yajñāḥ | ā-vivāsantaḥ | marutaḥ | yajanti ||5.45.4||,
5,45,4,b,5-45-4-B,ukthebhir hi ṣmā kavayaḥ suyajñā āvivāsanto maruto yajanti,"For verily sages, skilled in sacrificing, worship the Maruts and with lauds invite them.",उक्थेभिर्हि ष्मा कवयः सुयज्ञा आविवासन्तो मरुतो यजन्ति,5-45-4,su-uktebhiḥ | vaḥ | vacaḥ-bhiḥ | deva-juṣṭaiḥ | indrā | nu | agnī iti | avase | huvadhyai || ukthebhiḥ | hi | sma | kavayaḥ | su-yajñāḥ | ā-vivāsantaḥ | marutaḥ | yajanti ||5.45.4||,
5,45,5,a,5-45-5-A,eto nv adya sudhyo bhavāma pra ducchunā minavāmā varīyaḥ,"This day approach us: may our thoughts be holy, far from us let us cast away misfortune.",एतो न्वद्य सुध्यो भवाम प्र दुच्छुना मिनवामा वरीयः,5-45-5,eto iti | nu | adya | su-dhyaḥ | bhavāma | pra | ducchunāḥ | minavāma | varīyaḥ || āre | dveṣāṁsi | sanutaḥ | dadhāma | ayāma | prāñcaḥ | yajamānam | accha ||5.45.5||,
5,45,5,b,5-45-5-B,āre dveṣāṁsi sanutar dadhāmāyāma prāñco yajamānam accha,"Let us keep those who hate us at a distance, and haste to meet the man who sacrifices.",आरे द्वेषांसि सनुतर्दधामायाम प्राञ्चो यजमानमच्छ,5-45-5,eto iti | nu | adya | su-dhyaḥ | bhavāma | pra | ducchunāḥ | minavāma | varīyaḥ || āre | dveṣāṁsi | sanutaḥ | dadhāma | ayāma | prāñcaḥ | yajamānam | accha ||5.45.5||,
5,45,6,a,5-45-6-A,etā dhiyaṁ kṛṇavāmā sakhāyo 'pa yā mātām̐ ṛṇuta vrajaṁ goḥ,"Come, let us carry out, O friends, the purpose wherewith the Mother threw the Cow's stall open,",एता धियं कृणवामा सखायोऽप या माताँ ऋणुत व्रजं गोः,5-45-6,ā | ita | dhiyam | kr̥ṇavāma | sakhāyaḥ | apa | yā | mātā | r̥ṇuta | vrajam | goḥ || yayā | manuḥ | viśi-śipram | jigāya | yayā | vaṇik | vaṅkuḥ | āpa | purīṣam ||5.45.6||,
5,45,6,b,5-45-6-B,yayā manur viśiśipraṁ jigāya yayā vaṇig vaṅkur āpā purīṣam,"That wherewith Manu conquered Visisipra, wherewith the wandering merchant gained heaven's water.",यया मनुर्विशिशिप्रं जिगाय यया वणिग्वङ्कुरापा पुरीषम्,5-45-6,ā | ita | dhiyam | kr̥ṇavāma | sakhāyaḥ | apa | yā | mātā | r̥ṇuta | vrajam | goḥ || yayā | manuḥ | viśi-śipram | jigāya | yayā | vaṇik | vaṅkuḥ | āpa | purīṣam ||5.45.6||,
5,45,7,a,5-45-7-A,anūnod atra hastayato adrir ārcan yena daśa māso navagvāḥ,"Here, urged by hands, loudly hath rung the press-stone wherewith Navagvas through ten months sang praises",अनूनोदत्र हस्तयतो अद्रिरार्चन्येन दश मासो नवग्वाः,5-45-7,anūnot | atra | hasta-yataḥ | adriḥ | ārcan | yena | daśa | māsaḥ | nava-gvāḥ || r̥tam | yatī | saramā | gāḥ | avindat | viśvāni | satyā | aṅgirāḥ | cakāra ||5.45.7||,
5,45,7,b,5-45-7-B,ṛtaṁ yatī saramā gā avindad viśvāni satyāṅgirāś cakāra,Sarama went aright and found the cattle. Angiras gave effect to all their labours.,ऋतं यती सरमा गा अविन्दद्विश्वानि सत्याङ्गिराश्चकार,5-45-7,anūnot | atra | hasta-yataḥ | adriḥ | ārcan | yena | daśa | māsaḥ | nava-gvāḥ || r̥tam | yatī | saramā | gāḥ | avindat | viśvāni | satyā | aṅgirāḥ | cakāra ||5.45.7||,
5,45,8,a,5-45-8-A,viśve asyā vyuṣi māhināyāḥ saṁ yad gobhir aṅgiraso navanta,"When at the dawning of this mighty Goddess, Angirases all sang forth with the cattle,-",विश्वे अस्या व्युषि माहिनायाः सं यद्गोभिरङ्गिरसो नवन्त,5-45-8,viśve | asyāḥ | vi-uṣi | māhināyāḥ | sam | yat | gobhiḥ | aṅgirasaḥ | navanta || utsaḥ | āsām | parame | sadha-sthe | r̥tasya | pathā | saramā | vidat | gāḥ ||5.45.8||,
5,45,8,b,5-45-8-B,utsa āsām parame sadhastha ṛtasya pathā saramā vidad gāḥ,"Their spring is in the loftiest place of meeting,-Sarama found the kine by Order's pathway.",उत्स आसां परमे सधस्थ ऋतस्य पथा सरमा विदद्गाः,5-45-8,viśve | asyāḥ | vi-uṣi | māhināyāḥ | sam | yat | gobhiḥ | aṅgirasaḥ | navanta || utsaḥ | āsām | parame | sadha-sthe | r̥tasya | pathā | saramā | vidat | gāḥ ||5.45.8||,
5,45,9,a,5-45-9-A,ā sūryo yātu saptāśvaḥ kṣetraṁ yad asyorviyā dīrghayāthe,Borne by his Coursers Seven may Surya visit the field that spreadeth wide for his long journey.,आ सूर्यो यातु सप्ताश्वः क्षेत्रं यदस्योर्विया दीर्घयाथे,5-45-9,ā | sūryaḥ | yātu | sapta-aśvaḥ | kṣetram | yat | asya | urviyā | dīrgha-yāthe || raghuḥ | śyenaḥ | patayat | andhaḥ | accha | yuvā | kaviḥ | dīdayat | goṣu | gacchan ||5.45.9||,
5,45,9,b,5-45-9-B,raghuḥ śyenaḥ patayad andho acchā yuvā kavir dīdayad goṣu gacchan,Down on the Soma swooped the rapid Falcon. Bright was the young Sage moving mid his cattle.,रघुः श्येनः पतयदन्धो अच्छा युवा कविर्दीदयद्गोषु गच्छन्,5-45-9,ā | sūryaḥ | yātu | sapta-aśvaḥ | kṣetram | yat | asya | urviyā | dīrgha-yāthe || raghuḥ | śyenaḥ | patayat | andhaḥ | accha | yuvā | kaviḥ | dīdayat | goṣu | gacchan ||5.45.9||,
5,45,10,a,5-45-10-A,ā sūryo aruhac chukram arṇo 'yukta yad dharito vītapṛṣṭhāḥ,Surya hath mounted to the shining ocean when he hath yoked his fair-backed Tawny Horses.,आ सूर्यो अरुहच्छुक्रमर्णोऽयुक्त यद्धरितो वीतपृष्ठाः,5-45-10,ā | sūryaḥ | aruhat | śukram | arṇaḥ | ayukta | yat | haritaḥ | vīta-pr̥ṣṭhāḥ || udnā | na | nāvam | anayanta | dhīrāḥ | ā-śr̥ṇvatīḥ | āpaḥ | arvāk | atiṣṭhan ||5.45.10||,
5,45,10,b,5-45-10-B,udnā na nāvam anayanta dhīrā āśṛṇvatīr āpo arvāg atiṣṭhan,The wise have drawn him like a ship through water: the floods obedient have descended hither.,उद्ना न नावमनयन्त धीरा आशृण्वतीरापो अर्वागतिष्ठन्,5-45-10,ā | sūryaḥ | aruhat | śukram | arṇaḥ | ayukta | yat | haritaḥ | vīta-pr̥ṣṭhāḥ || udnā | na | nāvam | anayanta | dhīrāḥ | ā-śr̥ṇvatīḥ | āpaḥ | arvāk | atiṣṭhan ||5.45.10||,
5,45,11,a,5-45-11-A,dhiyaṁ vo apsu dadhiṣe svarṣāṁ yayātaran daśa māso navagvāḥ,"I lay upon the Floods your hymn, lightwinning, wherewith Navagvas their ten months completed.",धियं वो अप्सु दधिषे स्वर्षां ययातरन्दश मासो नवग्वाः,5-45-11,dhiyam | vaḥ | ap-su | dadhiṣe | svaḥ-sām | yayā | ataran | daśa | māsaḥ | nava-gvāḥ || ayā | dhiyā | syāma | deva-gopāḥ | ayā | dhiyā | tuturyāma | ati | aṁhaḥ ||5.45.11||,
5,45,11,b,5-45-11-B,ayā dhiyā syāma devagopā ayā dhiyā tuturyāmāty aṁhaḥ,Through this our hymn may we have Gods to guard us: through this our hymn pass safe beyond affliction.,अया धिया स्याम देवगोपा अया धिया तुतुर्यामात्यंहः,5-45-11,dhiyam | vaḥ | ap-su | dadhiṣe | svaḥ-sām | yayā | ataran | daśa | māsaḥ | nava-gvāḥ || ayā | dhiyā | syāma | deva-gopāḥ | ayā | dhiyā | tuturyāma | ati | aṁhaḥ ||5.45.11||,
5,46,1,a,5-46-1-A,hayo na vidvām̐ ayuji svayaṁ dhuri tāṁ vahāmi prataraṇīm avasyuvam,"WELL knowing I have bound me, horselike, to the pole: I carry that which bears as on and gives us help.",हयो न विद्वाँ अयुजि स्वयं धुरि तां वहामि प्रतरणीमवस्युवम्,5-46-1,hayaḥ | na | vidvān | ayuji | svayam | dhuri | tām | vahāmi | pra-taraṇīm | avasyuvam || na | asyāḥ | vaśmi | vi-mucam | na | ā-vr̥tam | punaḥ | vidvān | pathaḥ | puraḥ-etā | r̥ju | neṣati ||5.46.1||,
5,46,1,b,5-46-1-B,nāsyā vaśmi vimucaṁ nāvṛtam punar vidvān pathaḥ puraeta ṛju neṣati,"I seek for no release, no turning back therefrom. May he who knows the way, the Leader, guide me straig",नास्या वश्मि विमुचं नावृतं पुनर्विद्वान्पथः पुरएत ऋजु नेषति,5-46-1,hayaḥ | na | vidvān | ayuji | svayam | dhuri | tām | vahāmi | pra-taraṇīm | avasyuvam || na | asyāḥ | vaśmi | vi-mucam | na | ā-vr̥tam | punaḥ | vidvān | pathaḥ | puraḥ-etā | r̥ju | neṣati ||5.46.1||,
5,46,2,a,5-46-2-A,agna indra varuṇa mitra devāḥ śardhaḥ pra yanta mārutota viṣṇo,"O Agni, Indra, Varuna, and Mitra, give, O ye Gods, and Marut host, and Visnu.",अग्न इन्द्र वरुण मित्र देवाः शर्धः प्र यन्त मारुतोत विष्णो,5-46-2,agne | indra | varuṇa | mitra | devāḥ | śardhaḥ | pra | yanta | māruta | uta | viṣṇo iti || ubhā | nāsatyā | rudraḥ | adha | gnāḥ | pūṣā | bhagaḥ | sarasvatī | juṣanta ||5.46.2||,
5,46,2,b,5-46-2-B,ubhā nāsatyā rudro adha gnāḥ pūṣā bhagaḥ sarasvatī juṣanta,"May both Nasatyas, Rudra, heavenly Matrons, Pusan, Sarasvati, Bhaga, accept us.",उभा नासत्या रुद्रो अध ग्नाः पूषा भगः सरस्वती जुषन्त,5-46-2,agne | indra | varuṇa | mitra | devāḥ | śardhaḥ | pra | yanta | māruta | uta | viṣṇo iti || ubhā | nāsatyā | rudraḥ | adha | gnāḥ | pūṣā | bhagaḥ | sarasvatī | juṣanta ||5.46.2||,
5,46,3,a,5-46-3-A,indrāgnī mitrāvaruṇāditiṁ svaḥ pṛthivīṁ dyām marutaḥ parvatām̐ apaḥ,"Indra and Agni, Mitra, Varuna, Aditi, the Waters, Mountains, Maruts, Sky, and Earth and Heaven,",इन्द्राग्नी मित्रावरुणादितिं स्वः पृथिवीं द्यां मरुतः पर्वताँ अपः,5-46-3,indrāgnī iti | mitrāvaruṇā | aditim | svariti svaḥ | pr̥thivīm | dyām | marutaḥ | parvatān | apaḥ || huve | viṣṇum | pūṣaṇam | brahmaṇaḥ | patim | bhagam | nu | śaṁsam | savitāram | ūtaye ||5.46.3||,
5,46,3,b,5-46-3-B,huve viṣṇum pūṣaṇam brahmaṇas patim bhagaṁ nu śaṁsaṁ savitāram ūtaye,"Visnu I call, Pusan, and Brahmanaspati, and Bhaga, Samsa, Savitar that they may help.",हुवे विष्णुं पूषणं ब्रह्मणस्पतिं भगं नु शंसं सवितारमूतये,5-46-3,indrāgnī iti | mitrāvaruṇā | aditim | svariti svaḥ | pr̥thivīm | dyām | marutaḥ | parvatān | apaḥ || huve | viṣṇum | pūṣaṇam | brahmaṇaḥ | patim | bhagam | nu | śaṁsam | savitāram | ūtaye ||5.46.3||,
5,46,4,a,5-46-4-A,uta no viṣṇur uta vāto asridho draviṇodā uta somo mayas karat,"May Visnu also and Vata who injures none, and Soma granter of possessions give us joy;",उत नो विष्णुरुत वातो अस्रिधो द्रविणोदा उत सोमो मयस्करत्,5-46-4,uta | naḥ | viṣṇuḥ | uta | vātaḥ | asridhaḥ | draviṇaḥ-dāḥ | uta | somaḥ | mayaḥ | karat || uta | r̥bhavaḥ | uta | rāye | naḥ | aśvinā | uta | tvaṣṭā | uta | vi-bhvā | anu | maṁsate ||5.46.4||,
5,46,4,b,5-46-4-B,uta ṛbhava uta rāye no aśvinota tvaṣṭota vibhvānu maṁsate,"And may the Rbhus and the Asvins, Tvastar and Vibhvan remember us so that we may have wealth.",उत ऋभव उत राये नो अश्विनोत त्वष्टोत विभ्वानु मंसते,5-46-4,uta | naḥ | viṣṇuḥ | uta | vātaḥ | asridhaḥ | draviṇaḥ-dāḥ | uta | somaḥ | mayaḥ | karat || uta | r̥bhavaḥ | uta | rāye | naḥ | aśvinā | uta | tvaṣṭā | uta | vi-bhvā | anu | maṁsate ||5.46.4||,
5,46,5,a,5-46-5-A,uta tyan no mārutaṁ śardha ā gamad divikṣayaṁ yajatam barhir āsade,"So may the band of Maruts dwelling in the sky, the holy, come to us to sit on sacred grass;",उत त्यन्नो मारुतं शर्ध आ गमद्दिविक्षयं यजतं बर्हिरासदे,5-46-5,uta | tyat | naḥ | mārutam | śardhaḥ | ā | gamat | divi-kṣayam | yajatam | barhiḥ | ā-sade || br̥haspatiḥ | śarma | pūṣā | uta | naḥ | yamat | varūthyam | varuṇaḥ | mitraḥ | aryamā ||5.46.5||,
5,46,5,b,5-46-5-B,bṛhaspatiḥ śarma pūṣota no yamad varūthyaṁ varuṇo mitro aryamā,"Brhaspati and Pusan grant us sure defence, Varuna, Mitra, Aryaman guard and shelter us.",बृहस्पतिः शर्म पूषोत नो यमद्वरूथ्यं वरुणो मित्रो अर्यमा,5-46-5,uta | tyat | naḥ | mārutam | śardhaḥ | ā | gamat | divi-kṣayam | yajatam | barhiḥ | ā-sade || br̥haspatiḥ | śarma | pūṣā | uta | naḥ | yamat | varūthyam | varuṇaḥ | mitraḥ | aryamā ||5.46.5||,
5,46,6,a,5-46-6-A,uta tye naḥ parvatāsaḥ suśastayaḥ sudītayo nadyas trāmaṇe bhuvan,"And may the Mountains famed in noble eulogies, and the fair-gleaming Rivers keep us safe from harm.",उत त्ये नः पर्वतासः सुशस्तयः सुदीतयो नद्यस्त्रामणे भुवन्,5-46-6,uta | tye | naḥ | parvatāsaḥ | su-śastayaḥ | su-dītayaḥ | nadyaḥ | trāmaṇe | bhuvan || bhagaḥ | vi-bhaktā | śavasā | avasā | ā | gamat | uru-vyacāḥ | aditiḥ | śrotu | me | havam ||5.46.6||,
5,46,6,b,5-46-6-B,bhago vibhaktā śavasāvasā gamad uruvyacā aditiḥ śrotu me havam,"May Bhaga the Dispenser come with power and grace, and far-pervading Aditi listen to my call.",भगो विभक्ता शवसावसा गमदुरुव्यचा अदितिः श्रोतु मे हवम्,5-46-6,uta | tye | naḥ | parvatāsaḥ | su-śastayaḥ | su-dītayaḥ | nadyaḥ | trāmaṇe | bhuvan || bhagaḥ | vi-bhaktā | śavasā | avasā | ā | gamat | uru-vyacāḥ | aditiḥ | śrotu | me | havam ||5.46.6||,
