maṇḍala,sūkta,ṛca,paṅktī,index,IAST,Griffith,Devanāgarī,m-s-r,pada pāṭha,
5,60,1,a,5-60-1-A,īḻe agniṁ svavasaṁ namobhir iha prasatto vi cayat kṛtaṁ naḥ,I LAUD with reverence the gracious Agni: here may he sit and part our meed among us.,ईळे अग्निं स्ववसं नमोभिरिह प्रसत्तो वि चयत्कृतं नः,5-60-1,iḷe | agnim | su-avasam | namaḥ-bhiḥ | iha | pra-sattaḥ | vi | cayat | kr̥tam | naḥ || rathaiḥ-iva | pra | bhare | vājayat-bhiḥ | pra-dakṣiṇit | marutām | stomam | r̥dhyām ||5.60.1||,
5,60,1,b,5-60-1-B,rathair iva pra bhare vājayadbhiḥ pradakṣiṇin marutāṁ stomam ṛdhyām,"As with spoil-seeking cars I bring oblation: turned rightward I will swell the Marut's, praise-song.",रथैरिव प्र भरे वाजयद्भिः प्रदक्षिणिन्मरुतां स्तोममृध्याम्,5-60-1,iḷe | agnim | su-avasam | namaḥ-bhiḥ | iha | pra-sattaḥ | vi | cayat | kr̥tam | naḥ || rathaiḥ-iva | pra | bhare | vājayat-bhiḥ | pra-dakṣiṇit | marutām | stomam | r̥dhyām ||5.60.1||,
5,60,2,a,5-60-2-A,ā ye tasthuḥ pṛṣatīṣu śrutāsu sukheṣu rudrā maruto ratheṣu,"The Maruts, yea, the Rudras, who have mounted their famous spotted deer and cars swift-moving,-",आ ये तस्थुः पृषतीषु श्रुतासु सुखेषु रुद्रा मरुतो रथेषु,5-60-2,ā | ye | tasthuḥ | pr̥ṣatīṣu | śrutāsu | su-kheṣu | rudrāḥ | marutaḥ | ratheṣu || vanā | cit | ugrāḥ | jihate | ni | vaḥ | bhiyā | pr̥thivī | cit | rejate | parvataḥ | cit ||5.60.2||,
5,60,2,b,5-60-2-B,vanā cid ugrā jihate ni vo bhiyā pṛthivī cid rejate parvataś cit,"Before you, fierce Ones! woods bow down in terror: Earth, even the mountain, trembles at your coming.",वना चिदुग्रा जिहते नि वो भिया पृथिवी चिद्रेजते पर्वतश्चित्,5-60-2,ā | ye | tasthuḥ | pr̥ṣatīṣu | śrutāsu | su-kheṣu | rudrāḥ | marutaḥ | ratheṣu || vanā | cit | ugrāḥ | jihate | ni | vaḥ | bhiyā | pr̥thivī | cit | rejate | parvataḥ | cit ||5.60.2||,
5,60,3,a,5-60-3-A,parvataś cin mahi vṛddho bibhāya divaś cit sānu rejata svane vaḥ,"Though vast and tall, the mountain is affrighted, the height of heaven is shaken at your roaring",पर्वतश्चिन्महि वृद्धो बिभाय दिवश्चित्सानु रेजत स्वने वः,5-60-3,parvataḥ | cit | mahi | vr̥ddhaḥ | bibhāya | divaḥ | cit | sānu | rejata | svane | vaḥ || yat | krīḷatha | marutaḥ | r̥ṣṭi-mantaḥ | āpaḥ-iva | sadhryañcaḥ | dhavadhve ||5.60.3||,
5,60,3,b,5-60-3-B,yat krīḻatha maruta ṛṣṭimanta āpa iva sadhryañco dhavadhve,"When, armed with lances, ye are sporting, Maruts, and rush along together like the waters.",यत्क्रीळथ मरुत ऋष्टिमन्त आप इव सध्र्यञ्चो धवध्वे,5-60-3,parvataḥ | cit | mahi | vr̥ddhaḥ | bibhāya | divaḥ | cit | sānu | rejata | svane | vaḥ || yat | krīḷatha | marutaḥ | r̥ṣṭi-mantaḥ | āpaḥ-iva | sadhryañcaḥ | dhavadhve ||5.60.3||,
5,60,4,a,5-60-4-A,varā ived raivatāso hiraṇyair abhi svadhābhis tanvaḥ pipiśre,"They, like young suitors, sons of wealthy houses, have with their golden natures decked their bodies.",वरा इवेद्रैवतासो हिरण्यैरभि स्वधाभिस्तन्वः पिपिश्रे,5-60-4,varāḥ-iva | it | raivatāsaḥ | hiraṇyaiḥ | abhi | svadhābhiḥ | tanvaḥ | pipiśre || śriye | śreyāṁsaḥ | tavasaḥ | ratheṣu | satrā | mahāṁsi | cakrire | tanūṣu ||5.60.4||,
5,60,4,b,5-60-4-B,śriye śreyāṁsas tavaso ratheṣu satrā mahāṁsi cakrire tanūṣu,"Strong on their cars, the lordly Ones, for glory, have set their splendours on their forms for ever.",श्रिये श्रेयांसस्तवसो रथेषु सत्रा महांसि चक्रिरे तनूषु,5-60-4,varāḥ-iva | it | raivatāsaḥ | hiraṇyaiḥ | abhi | svadhābhiḥ | tanvaḥ | pipiśre || śriye | śreyāṁsaḥ | tavasaḥ | ratheṣu | satrā | mahāṁsi | cakrire | tanūṣu ||5.60.4||,
5,60,5,a,5-60-5-A,ajyeṣṭhāso akaniṣṭhāsa ete sam bhrātaro vāvṛdhuḥ saubhagāya,"None being eldest, none among them youngest, as brothers they have grown to happy fortune.",अज्येष्ठासो अकनिष्ठास एते सं भ्रातरो वावृधुः सौभगाय,5-60-5,ajyeṣṭhāsaḥ | akaniṣṭhāsaḥ | ete | sam | bhrātaraḥ | vavr̥dhuḥ | saubhagāya || yuvā | pitā | su-apā | rudraḥ | eṣām | su-dughā | pr̥śniḥ | su-dinā | marut-bhyaḥ ||5.60.5||,
5,60,5,b,5-60-5-B,yuvā pitā svapā rudra eṣāṁ sudughā pṛśniḥ sudinā marudbhyaḥ,"May their Sire Rudra, young and deft, and Prsni pouring much milk, bring fair days to the Maruts.",युवा पिता स्वपा रुद्र एषां सुदुघा पृश्निः सुदिना मरुद्भ्यः,5-60-5,ajyeṣṭhāsaḥ | akaniṣṭhāsaḥ | ete | sam | bhrātaraḥ | vavr̥dhuḥ | saubhagāya || yuvā | pitā | su-apā | rudraḥ | eṣām | su-dughā | pr̥śniḥ | su-dinā | marut-bhyaḥ ||5.60.5||,
5,60,6,a,5-60-6-A,yad uttame maruto madhyame vā yad vāvame subhagāso divi ṣṭha,"Whether, O blessed Maruts, ye be dwelling in highest, midmost, or in lowest heaven,",यदुत्तमे मरुतो मध्यमे वा यद्वावमे सुभगासो दिवि ष्ठ,5-60-6,yat | ut-tame | marutaḥ | madhyame | vā | yat | vā | avame | su-bhagāsaḥ | divi | stha || ataḥ | naḥ | rudrāḥ | uta | vā | nu | asya | agne | vittāt | haviṣaḥ | yat | yajāma ||5.60.6||,
5,60,6,b,5-60-6-B,ato no rudrā uta vā nv asyāgne vittād dhaviṣo yad yajāma,"Thence, O ye Rudras, and thou also, Agni, notice the sacrificial food we offer.",अतो नो रुद्रा उत वा न्वस्याग्ने वित्ताद्धविषो यद्यजाम,5-60-6,yat | ut-tame | marutaḥ | madhyame | vā | yat | vā | avame | su-bhagāsaḥ | divi | stha || ataḥ | naḥ | rudrāḥ | uta | vā | nu | asya | agne | vittāt | haviṣaḥ | yat | yajāma ||5.60.6||,
5,60,7,a,5-60-7-A,agniś ca yan maruto viśvavedaso divo vahadhva uttarād adhi ṣṇubhiḥ,"O Maruts, Lords of all, when Agni and when ye drive downward from sublimest heaven along the heights,",अग्निश्च यन्मरुतो विश्ववेदसो दिवो वहध्व उत्तरादधि ष्णुभिः,5-60-7,agniḥ | ca | yat | marutaḥ | viśva-vedasaḥ | divaḥ | vahadhve | ut-tarāt | adhi | snu-bhiḥ || te | mandasānāḥ | dhunayaḥ | riśādasaḥ | vāmam | dhatta | yajamānāya | sunvate ||5.60.7||,
5,60,7,b,5-60-7-B,te mandasānā dhunayo riśādaso vāmaṁ dhatta yajamānāya sunvate,"Shakers of all, rejoicing, slayers of the foe, give riches to the Soma-pressing worshipper.",ते मन्दसाना धुनयो रिशादसो वामं धत्त यजमानाय सुन्वते,5-60-7,agniḥ | ca | yat | marutaḥ | viśva-vedasaḥ | divaḥ | vahadhve | ut-tarāt | adhi | snu-bhiḥ || te | mandasānāḥ | dhunayaḥ | riśādasaḥ | vāmam | dhatta | yajamānāya | sunvate ||5.60.7||,
5,60,8,a,5-60-8-A,agne marudbhiḥ śubhayadbhir ṛkvabhiḥ somam piba mandasāno gaṇaśribhiḥ,"O Agni, with the Maruts as they gleam and sing, gathered in troop, rejoicing drink the Soma juice;",अग्ने मरुद्भिः शुभयद्भिरृक्वभिः सोमं पिब मन्दसानो गणश्रिभिः,5-60-8,agne | marut-bhiḥ | śubhayat-bhiḥ | r̥kva-bhiḥ | somam | piba | mandasānaḥ | gaṇaśri-bhiḥ || pāvakebhiḥ | viśvam-invebhiḥ | āyu-bhiḥ | vaiśvānara | pra-divā | ketunā | sa-jūḥ ||5.60.8||,
5,60,8,b,5-60-8-B,pāvakebhir viśvaminvebhir āyubhir vaiśvānara pradivā ketunā sajūḥ,"With these the living ones who cleanse and further all, joined with thy banner, O Vaisvanara, from of ol",पावकेभिर्विश्वमिन्वेभिरायुभिर्वैश्वानर प्रदिवा केतुना सजूः,5-60-8,agne | marut-bhiḥ | śubhayat-bhiḥ | r̥kva-bhiḥ | somam | piba | mandasānaḥ | gaṇaśri-bhiḥ || pāvakebhiḥ | viśvam-invebhiḥ | āyu-bhiḥ | vaiśvānara | pra-divā | ketunā | sa-jūḥ ||5.60.8||,
5,61,1,a,5-61-1-A,ke ṣṭhā naraḥ śreṣṭhatamā ya eka-eka āyaya,"O HEROES lordliest of all, who are ye that have singly come",के ष्ठा नरः श्रेष्ठतमा य एकएक आयय,5-61-1,ke | stha | naraḥ | śreṣṭha-tamāḥ | ye | ekaḥ-ekaḥ | ā-yaya || paramasyāḥ | parā-vataḥ ||5.61.1||,
5,61,1,b,5-61-1-B,paramasyāḥ parāvataḥ,Forth from a region most remote?,परमस्याः परावतः,5-61-1,ke | stha | naraḥ | śreṣṭha-tamāḥ | ye | ekaḥ-ekaḥ | ā-yaya || paramasyāḥ | parā-vataḥ ||5.61.1||,
5,61,2,a,5-61-2-A,kva vo 'śvāḥ kvābhīśavaḥ kathaṁ śeka kathā yaya,"Where are your horses, where the reins? How came ye? how had ye the power?",क्व वोऽश्वाः क्वाभीशवः कथं शेक कथा यय,5-61-2,kva | vaḥ | aśvāḥ | kva | abhīśavaḥ | katham | śeka | kathā | yaya || pr̥ṣṭhe | sadaḥ | nasoḥ | yamaḥ ||5.61.2||,
5,61,2,b,5-61-2-B,pṛṣṭhe sado nasor yamaḥ,Rein was on nose and seat on back.,पृष्ठे सदो नसोर्यमः,5-61-2,kva | vaḥ | aśvāḥ | kva | abhīśavaḥ | katham | śeka | kathā | yaya || pr̥ṣṭhe | sadaḥ | nasoḥ | yamaḥ ||5.61.2||,
5,61,3,a,5-61-3-A,jaghane coda eṣāṁ vi sakthāni naro yamuḥ,"The whip is laid upon the flank. The heroes stretch their thighs apart,",जघने चोद एषां वि सक्थानि नरो यमुः,5-61-3,jaghane | codaḥ | eṣām | vi | sakthāni | naraḥ | yamuḥ || putra-kr̥the | na | janayaḥ ||5.61.3||,
5,61,3,b,5-61-3-B,putrakṛthe na janayaḥ,Like women when the babe is born.,पुत्रकृथे न जनयः,5-61-3,jaghane | codaḥ | eṣām | vi | sakthāni | naraḥ | yamuḥ || putra-kr̥the | na | janayaḥ ||5.61.3||,
5,61,4,a,5-61-4-A,parā vīrāsa etana maryāso bhadrajānayaḥ,"Go ye, O Heroes, far away, ye bridegrooms with a lovely Spouse",परा वीरास एतन मर्यासो भद्रजानयः,5-61-4,parā | vīrāsaḥ | itana | maryāsaḥ | bhadra-jānayaḥ || agni-tapaḥ | yathā | asatha ||5.61.4||,
5,61,4,b,5-61-4-B,agnitapo yathāsatha,That ye may warm you at the fire.,अग्नितपो यथासथ,5-61-4,parā | vīrāsaḥ | itana | maryāsaḥ | bhadra-jānayaḥ || agni-tapaḥ | yathā | asatha ||5.61.4||,
5,61,5,a,5-61-5-A,sanat sāśvyam paśum uta gavyaṁ śatāvayam,"May she gain cattle for her meed, hundreds of sheep and steeds and kine,",सनत्साश्व्यं पशुमुत गव्यं शतावयम्,5-61-5,sanat | sā | aśvyam | paśum | uta | gavyam | śata-avayam || śyāvāśva-stutāya | yā | doḥ | vīrāya | upa-barbr̥hat ||5.61.5||,
5,61,5,b,5-61-5-B,śyāvāśvastutāya yā dor vīrāyopabarbṛhat,Who threw embracing arms around the hero whom gyavaiva praised.,श्यावाश्वस्तुताय या दोर्वीरायोपबर्बृहत्,5-61-5,sanat | sā | aśvyam | paśum | uta | gavyam | śata-avayam || śyāvāśva-stutāya | yā | doḥ | vīrāya | upa-barbr̥hat ||5.61.5||,
5,61,6,a,5-61-6-A,uta tvā strī śaśīyasī puṁso bhavati vasyasī,"Yea, many a woman is more firm and better than the man who turns",उत त्वा स्त्री शशीयसी पुंसो भवति वस्यसी,5-61-6,uta | tvā | strī | śaśīyasī | puṁsaḥ | bhavati | vasyasī || adeva-trāt | arādhasaḥ ||5.61.6||,
5,61,6,b,5-61-6-B,adevatrād arādhasaḥ,"Away from Gods, andoffers not.",अदेवत्रादराधसः,5-61-6,uta | tvā | strī | śaśīyasī | puṁsaḥ | bhavati | vasyasī || adeva-trāt | arādhasaḥ ||5.61.6||,
5,61,7,a,5-61-7-A,vi yā jānāti jasuriṁ vi tṛṣyantaṁ vi kāminam,"She who discerns the weak and worn, the man who thirsts and is in want",वि या जानाति जसुरिं वि तृष्यन्तं वि कामिनम्,5-61-7,vi | yā | jānāti | jasurim | vi | tr̥ṣyantam | vi | kāminam || deva-trā | kr̥ṇute | manaḥ ||5.61.7||,
5,61,7,b,5-61-7-B,devatrā kṛṇute manaḥ,She sets her mind upon the Gods.,देवत्रा कृणुते मनः,5-61-7,vi | yā | jānāti | jasurim | vi | tr̥ṣyantam | vi | kāminam || deva-trā | kr̥ṇute | manaḥ ||5.61.7||,
5,61,8,a,5-61-8-A,uta ghā nemo astutaḥ pumām̐ iti bruve paṇiḥ,"And yet full many a one, unpraised, mean niggard, is entitled man:",उत घा नेमो अस्तुतः पुमाँ इति ब्रुवे पणिः,5-61-8,uta | gha | nemaḥ | astutaḥ | pumān | iti | bruve | paṇiḥ || saḥ | vaira-deye | it | samaḥ ||5.61.8||,
5,61,8,b,5-61-8-B,sa vairadeya it samaḥ,Only in weregild is he such.,स वैरदेय इत्समः,5-61-8,uta | gha | nemaḥ | astutaḥ | pumān | iti | bruve | paṇiḥ || saḥ | vaira-deye | it | samaḥ ||5.61.8||,
5,61,9,a,5-61-9-A,uta me 'rapad yuvatir mamanduṣī prati śyāvāya vartanim,"And she, the young, the joyous-spirited, divulged the path to Syava, yea, to me.",उत मेऽरपद्युवतिर्ममन्दुषी प्रति श्यावाय वर्तनिम्,5-61-9,uta | me | arapat | yuvatiḥ | mamanduṣī | prati | śyāvāya | vartanim || vi | rohitā | puru-mīḷhāya | yematuḥ | viprāya | dīrgha-yaśase ||5.61.9||,
5,61,9,b,5-61-9-B,vi rohitā purumīḻhāya yematur viprāya dīrghayaśase,"Two red steeds carried me to Purumilha's side, that sage of far-extended fame,",वि रोहिता पुरुमीळ्हाय येमतुर्विप्राय दीर्घयशसे,5-61-9,uta | me | arapat | yuvatiḥ | mamanduṣī | prati | śyāvāya | vartanim || vi | rohitā | puru-mīḷhāya | yematuḥ | viprāya | dīrgha-yaśase ||5.61.9||,
5,61,10,a,5-61-10-A,yo me dhenūnāṁ śataṁ vaidadaśvir yathā dadat,"Him who, like Vaidadasvi, like Taranta, hath bestowed on me",यो मे धेनूनां शतं वैददश्विर्यथा ददत्,5-61-10,yaḥ | me | dhenūnām | śatam | vaidat-aśviḥ | yathā | dadat || tarantaḥ-iva | maṁhanā ||5.61.10||,
5,61,10,b,5-61-10-B,taranta iva maṁhanā,A hundred cows in liberal gift.,तरन्त इव मंहना,5-61-10,yaḥ | me | dhenūnām | śatam | vaidat-aśviḥ | yathā | dadat || tarantaḥ-iva | maṁhanā ||5.61.10||,
5,61,11,a,5-61-11-A,ya īṁ vahanta āśubhiḥ pibanto madiram madhu,"They who are borne by rapid steeds, drinking the meath that gives delight,",य ईं वहन्त आशुभिः पिबन्तो मदिरं मधु,5-61-11,ye | īm | vahante | āśu-bhiḥ | pibantaḥ | madiram | madhu || atra | śravāṁsi | dadhire ||5.61.11||,
5,61,11,b,5-61-11-B,atra śravāṁsi dadhire,They have attained high glories here.,अत्र श्रवांसि दधिरे,5-61-11,ye | īm | vahante | āśu-bhiḥ | pibantaḥ | madiram | madhu || atra | śravāṁsi | dadhire ||5.61.11||,
5,61,12,a,5-61-12-A,yeṣāṁ śriyādhi rodasī vibhrājante ratheṣv ā,They by whose splendour both the worlds are over-spread they shine on cars,येषां श्रियाधि रोदसी विभ्राजन्ते रथेष्वा,5-61-12,yeṣām | śriyā | adhi | rodasī iti | vi-bhrājante | ratheṣu | ā || divi | rukmaḥ-iva | upari ||5.61.12||,
5,61,12,b,5-61-12-B,divi rukma ivopari,As the gold gleams above in heaven.,दिवि रुक्म इवोपरि,5-61-12,yeṣām | śriyā | adhi | rodasī iti | vi-bhrājante | ratheṣu | ā || divi | rukmaḥ-iva | upari ||5.61.12||,
5,61,13,a,5-61-13-A,yuvā sa māruto gaṇas tveṣaratho anedyaḥ,"That Marut band is ever young, borne on bright cars, unblamable,",युवा स मारुतो गणस्त्वेषरथो अनेद्यः,5-61-13,yuvā | saḥ | mārutaḥ | gaṇaḥ | tveṣa-rathaḥ | anedyaḥ || śubham-yāvā | aprati-skutaḥ ||5.61.13||,
5,61,13,b,5-61-13-B,śubhaṁyāvāpratiṣkutaḥ,"Moving to victory, checked by none.",शुभंयावाप्रतिष्कुतः,5-61-13,yuvā | saḥ | mārutaḥ | gaṇaḥ | tveṣa-rathaḥ | anedyaḥ || śubham-yāvā | aprati-skutaḥ ||5.61.13||,
5,61,14,a,5-61-14-A,ko veda nūnam eṣāṁ yatrā madanti dhūtayaḥ,"Who knoweth, verily, of these where the All-shakers take delight,",को वेद नूनमेषां यत्रा मदन्ति धूतयः,5-61-14,kaḥ | veda | nūnam | eṣām | yatra | madanti | dhūtayaḥ || r̥ta-jātāḥ | arepasaḥ ||5.61.14||,
5,61,14,b,5-61-14-B,ṛtajātā arepasaḥ,"Born, spotless, after sacred Law?",ऋतजाता अरेपसः,5-61-14,kaḥ | veda | nūnam | eṣām | yatra | madanti | dhūtayaḥ || r̥ta-jātāḥ | arepasaḥ ||5.61.14||,
5,61,15,a,5-61-15-A,yūyam martaṁ vipanyavaḥ praṇetāra itthā dhiyā,"Guides are ye, lovers of the song to mortal man through holy hymn,",यूयं मर्तं विपन्यवः प्रणेतार इत्था धिया,5-61-15,yūyam | martam | vipanyavaḥ | pra-netāraḥ | itthā | dhiyā || śrotāraḥ | yāma-hūtiṣu ||5.61.15||,
5,61,15,b,5-61-15-B,śrotāro yāmahūtiṣu,And hearers when he cries for help.,श्रोतारो यामहूतिषु,5-61-15,yūyam | martam | vipanyavaḥ | pra-netāraḥ | itthā | dhiyā || śrotāraḥ | yāma-hūtiṣu ||5.61.15||,
5,61,16,a,5-61-16-A,te no vasūni kāmyā puruścandrā riśādasaḥ,"Do ye, destroyers of the foe, worshipful and exceeding bright,",ते नो वसूनि काम्या पुरुश्चन्द्रा रिशादसः,5-61-16,te | naḥ | vasūni | kāmyā | puru-candrāḥ | riśādasaḥ || ā | yajñiyāsaḥ | vavr̥ttana ||5.61.16||,
5,61,16,b,5-61-16-B,ā yajñiyāso vavṛttana,Send down the treasures that we crave.,आ यज्ञियासो ववृत्तन,5-61-16,te | naḥ | vasūni | kāmyā | puru-candrāḥ | riśādasaḥ || ā | yajñiyāsaḥ | vavr̥ttana ||5.61.16||,
5,61,17,a,5-61-17-A,etam me stomam ūrmye dārbhyāya parā vaha,"OUrmya, bear thou far away to Darbhya this my hymn of praise,",एतं मे स्तोममूर्म्ये दार्भ्याय परा वह,5-61-17,etam | me | stomam | ūrmye | dārbhyāya | parā | vaha || giraḥ | devi | rathīḥ-iva ||5.61.17||,
5,61,17,b,5-61-17-B,giro devi rathīr iva,"Songs, Goddess, as if chariot-borne.",गिरो देवि रथीरिव,5-61-17,etam | me | stomam | ūrmye | dārbhyāya | parā | vaha || giraḥ | devi | rathīḥ-iva ||5.61.17||,
5,61,18,a,5-61-18-A,uta me vocatād iti sutasome rathavītau,"From me to Rathaviti say, when he hath pressed the Soma juice,",उत मे वोचतादिति सुतसोमे रथवीतौ,5-61-18,uta | me | vocatāt | iti | suta-some | ratha-vītau || na | kāmaḥ | apa | veti | me ||5.61.18||,
5,61,18,b,5-61-18-B,na kāmo apa veti me,The wish I had departeth not.,न कामो अप वेति मे,5-61-18,uta | me | vocatāt | iti | suta-some | ratha-vītau || na | kāmaḥ | apa | veti | me ||5.61.18||,
5,61,19,a,5-61-19-A,eṣa kṣeti rathavītir maghavā gomatīr anu,"This wealthy Rathaviti dwells among the people rich in kine,",एष क्षेति रथवीतिर्मघवा गोमतीरनु,5-61-19,eṣaḥ | kṣeti | ratha-vītiḥ | magha-vā | go-matīḥ | anu || parvateṣu | apa-śritaḥ ||5.61.19||,
5,61,19,b,5-61-19-B,parvateṣv apaśritaḥ,"Among the mountains, far withdrawn.",पर्वतेष्वपश्रितः,5-61-19,eṣaḥ | kṣeti | ratha-vītiḥ | magha-vā | go-matīḥ | anu || parvateṣu | apa-śritaḥ ||5.61.19||,
5,62,1,a,5-62-1-A,ṛtena ṛtam apihitaṁ dhruvaṁ vāṁ sūryasya yatra vimucanty aśvān,BY your high Law firm order is established there where they loose for travel Surya's horses.,ऋतेन ऋतमपिहितं ध्रुवं वां सूर्यस्य यत्र विमुचन्त्यश्वान्,5-62-1,r̥tena | r̥tam | api-hitam | dhruvam | vām | sūryasya | yatra | vi-mucanti | aśvān || daśa | śatā | saha | tasthuḥ | tat | ekam | devānām | śreṣṭham | vapuṣām | apaśyam ||5.62.1||,
5,62,1,b,5-62-1-B,daśa śatā saha tasthus tad ekaṁ devānāṁ śreṣṭhaṁ vapuṣām apaśyam,Ten hundred stood together: there I looked on this the most marvellous Deities' one chief glory.,दश शता सह तस्थुस्तदेकं देवानां श्रेष्ठं वपुषामपश्यम्,5-62-1,r̥tena | r̥tam | api-hitam | dhruvam | vām | sūryasya | yatra | vi-mucanti | aśvān || daśa | śatā | saha | tasthuḥ | tat | ekam | devānām | śreṣṭham | vapuṣām | apaśyam ||5.62.1||,
5,62,2,a,5-62-2-A,tat su vām mitrāvaruṇā mahitvam īrmā tasthuṣīr ahabhir duduhre,"This, Mitra-Varuna, is your special greatness: floods that stood there they with the days attracted.",तत्सु वां मित्रावरुणा महित्वमीर्मा तस्थुषीरहभिर्दुदुह्रे,5-62-2,tat | su | vām | mitrāvaruṇā | mahi-tvam | īrmā | tasthuṣīḥ | aha-bhiḥ | duduhre || viśvāḥ | pinvathaḥ | svasarasya | dhenāḥ | anu | vām | ekaḥ | paviḥ | ā | vavarta ||5.62.2||,
5,62,2,b,5-62-2-B,viśvāḥ pinvathaḥ svasarasya dhenā anu vām ekaḥ pavir ā vavarta,Ye cause to flow all voices of the cowpen: your single chariotfelly hath rolled hither.,विश्वाः पिन्वथः स्वसरस्य धेना अनु वामेकः पविरा ववर्त,5-62-2,tat | su | vām | mitrāvaruṇā | mahi-tvam | īrmā | tasthuṣīḥ | aha-bhiḥ | duduhre || viśvāḥ | pinvathaḥ | svasarasya | dhenāḥ | anu | vām | ekaḥ | paviḥ | ā | vavarta ||5.62.2||,
5,62,3,a,5-62-3-A,adhārayatam pṛthivīm uta dyām mitrarājānā varuṇā mahobhiḥ,"O Mitra-Varuna, ye by your greatness, both Kings, have firmly stablished earth and heaven,",अधारयतं पृथिवीमुत द्यां मित्रराजाना वरुणा महोभिः,5-62-3,adhārayatam | pr̥thivīm | uta | dyām | mitra-rājānā | varuṇā | mahaḥ-bhiḥ || vardhayatam | oṣadhīḥ | pinvatam | gāḥ | ava | vr̥ṣṭim | sr̥jatam | jīradānū iti jīra-dānū ||5.62.3||,
5,62,3,b,5-62-3-B,vardhayatam oṣadhīḥ pinvataṁ gā ava vṛṣṭiṁ sṛjataṁ jīradānū,"Ye caused the cows to stream, the plants to flourish, and, scattering swift drops, sent down the rain-fl",वर्धयतमोषधीः पिन्वतं गा अव वृष्टिं सृजतं जीरदानू,5-62-3,adhārayatam | pr̥thivīm | uta | dyām | mitra-rājānā | varuṇā | mahaḥ-bhiḥ || vardhayatam | oṣadhīḥ | pinvatam | gāḥ | ava | vr̥ṣṭim | sr̥jatam | jīradānū iti jīra-dānū ||5.62.3||,
5,62,4,a,5-62-4-A,ā vām aśvāsaḥ suyujo vahantu yataraśmaya upa yantv arvāk,Let your well-harnessed horses bear you hither: hitherward let them come with reins drawn tightly.,आ वामश्वासः सुयुजो वहन्तु यतरश्मय उप यन्त्वर्वाक्,5-62-4,ā | vām | aśvāsaḥ | su-yujaḥ | vahantu | yata-raśmayaḥ | upa | yantu | arvāk || ghr̥tasya | niḥ-nik | anu | vartate | vām | upa | sindhavaḥ | pra-divi | kṣaranti ||5.62.4||,
5,62,4,b,5-62-4-B,ghṛtasya nirṇig anu vartate vām upa sindhavaḥ pradivi kṣaranti,"A covering cloud of sacred oil attends you, and your streams flow to us from days aforetime.",घृतस्य निर्णिगनु वर्तते वामुप सिन्धवः प्रदिवि क्षरन्ति,5-62-4,ā | vām | aśvāsaḥ | su-yujaḥ | vahantu | yata-raśmayaḥ | upa | yantu | arvāk || ghr̥tasya | niḥ-nik | anu | vartate | vām | upa | sindhavaḥ | pra-divi | kṣaranti ||5.62.4||,
5,62,5,a,5-62-5-A,anu śrutām amatiṁ vardhad urvīm barhir iva yajuṣā rakṣamāṇā,"To make the lustre wider and more famous, guarding the sacred grass with veneration,",अनु श्रुताममतिं वर्धदुर्वीं बर्हिरिव यजुषा रक्षमाणा,5-62-5,anu | śrutām | amatim | vardhat | urvīm | barhiḥ-iva | yajuṣā | rakṣamāṇā || namasvantā | dhr̥ta-dakṣā | adhi | garte | mitra | āsāthe iti | varuṇa | iḷāsu | antariti ||5.62.5||,
