maṇḍala,sūkta,ṛca,paṅktī,index,IAST,Griffith,Devanāgarī,m-s-r,pada pāṭha,
5,29,5,a,5-29-5-A,adha kratvā maghavan tubhyaṁ devā anu viśve adaduḥ somapeyam,"Thus all the Gods, O Maghavan, delivered to thee of their free will the draught of Soma;",अध क्रत्वा मघवन्तुभ्यं देवा अनु विश्वे अददुः सोमपेयम्,5-29-5,adha | kratvā | magha-van | tubhyam | devāḥ | anu | viśve | adaduḥ | soma-peyam || yat | sūryasya | haritaḥ | patantīḥ | puraḥ | satīḥ | uparāḥ | etaśe | kariti kaḥ ||5.29.5||,
5,29,5,b,5-29-5-B,yat sūryasya haritaḥ patantīḥ puraḥ satīr uparā etaśe kaḥ,When thou for Etasa didst cause to tarry the flying mares of Surya racing forward.,यत्सूर्यस्य हरितः पतन्तीः पुरः सतीरुपरा एतशे कः,5-29-5,adha | kratvā | magha-van | tubhyam | devāḥ | anu | viśve | adaduḥ | soma-peyam || yat | sūryasya | haritaḥ | patantīḥ | puraḥ | satīḥ | uparāḥ | etaśe | kariti kaḥ ||5.29.5||,
5,29,6,a,5-29-6-A,nava yad asya navatiṁ ca bhogān sākaṁ vajreṇa maghavā vivṛścat,"When Maghavan with the thunderbolt demolished his nine-and-ninety castles all together,",नव यदस्य नवतिं च भोगान्साकं वज्रेण मघवा विवृश्चत्,5-29-6,nava | yat | asya | navatim | ca | bhogān | sākam | vajreṇa | magha-vā | vivr̥ścat || arcanti | indram | marutaḥ | sadha-sthe | traistubhena | vacasā | bādhata | dyām ||5.29.6||,
5,29,6,b,5-29-6-B,arcantīndram marutaḥ sadhasthe traiṣṭubhena vacasā bādhata dyām,"The Maruts, where they met, glorified Indra: ye with the Trstup hymn obstructed heaven.",अर्चन्तीन्द्रं मरुतः सधस्थे त्रैष्टुभेन वचसा बाधत द्याम्,5-29-6,nava | yat | asya | navatim | ca | bhogān | sākam | vajreṇa | magha-vā | vivr̥ścat || arcanti | indram | marutaḥ | sadha-sthe | traistubhena | vacasā | bādhata | dyām ||5.29.6||,
5,29,7,a,5-29-7-A,sakhā sakhye apacat tūyam agnir asya kratvā mahiṣā trī śatāni,"As friend to aid a friend, Agni dressed quickly three hundred buffaloes, even as he willed it.",सखा सख्ये अपचत्तूयमग्निरस्य क्रत्वा महिषा त्री शतानि,5-29-7,sakhā | sakhye | apacat | tūyam | agniḥ | asya | kratvā | mahiṣā | trī | śatāni || trī | sākam | indraḥ | manuṣaḥ | sarāṁsi | sutam | pibat | vr̥tra-hatyāya | somam ||5.29.7||,
5,29,7,b,5-29-7-B,trī sākam indro manuṣaḥ sarāṁsi sutam pibad vṛtrahatyāya somam,"And Indra, from man's gift, for Vrtra's slaughter, drank ofr at once three lakes of pressed-out Soma.",त्री साकमिन्द्रो मनुषः सरांसि सुतं पिबद्वृत्रहत्याय सोमम्,5-29-7,sakhā | sakhye | apacat | tūyam | agniḥ | asya | kratvā | mahiṣā | trī | śatāni || trī | sākam | indraḥ | manuṣaḥ | sarāṁsi | sutam | pibat | vr̥tra-hatyāya | somam ||5.29.7||,
5,29,8,a,5-29-8-A,trī yac chatā mahiṣāṇām agho mās trī sarāṁsi maghavā somyāpāḥ,"When thou three hundred buffaloes' flesh hadst eaten, and drunk, as Maghavan, three lakes of Soma,",त्री यच्छता महिषाणामघो मास्त्री सरांसि मघवा सोम्यापाः,5-29-8,trī | yat | śatā | mahiṣāṇām | aghaḥ | māḥ | trī | sarāṁsi | magha-vā | somyā | apāḥ || kāram | na | viśve | ahvanta | devāḥ | bharam | indrāya | yat | ahim | jaghāna ||5.29.8||,
5,29,8,b,5-29-8-B,kāraṁ na viśve ahvanta devā bharam indrāya yad ahiṁ jaghāna,All the Gods raised as 'twere a shout of triumph to Indra praise because he slew the Dragon.,कारं न विश्वे अह्वन्त देवा भरमिन्द्राय यदहिं जघान,5-29-8,trī | yat | śatā | mahiṣāṇām | aghaḥ | māḥ | trī | sarāṁsi | magha-vā | somyā | apāḥ || kāram | na | viśve | ahvanta | devāḥ | bharam | indrāya | yat | ahim | jaghāna ||5.29.8||,
5,29,9,a,5-29-9-A,uśanā yat sahasyair ayātaṁ gṛham indra jūjuvānebhir aśvaiḥ,"What time ye came with strong steeds swiftly speeding, O Usana and Indra, to the dwelling,",उशना यत्सहस्यैरयातं गृहमिन्द्र जूजुवानेभिरश्वैः,5-29-9,uśanā | yat | sahasyaiḥ | ayātam | gr̥ham | indra | jūjuvānebhiḥ | aśvaiḥ || vanvānaḥ | atra | sa-ratham | yayātha | kutsena | devaiḥ | avanoḥ | ha | śuṣṇam ||5.29.9||,
5,29,9,b,5-29-9-B,vanvāno atra sarathaṁ yayātha kutsena devair avanor ha śuṣṇam,Thou camest thither -conquering together with Kutsa and the Gods: thou slewest Susna.,वन्वानो अत्र सरथं ययाथ कुत्सेन देवैरवनोर्ह शुष्णम्,5-29-9,uśanā | yat | sahasyaiḥ | ayātam | gr̥ham | indra | jūjuvānebhiḥ | aśvaiḥ || vanvānaḥ | atra | sa-ratham | yayātha | kutsena | devaiḥ | avanoḥ | ha | śuṣṇam ||5.29.9||,
5,29,10,a,5-29-10-A,prānyac cakram avṛhaḥ sūryasya kutsāyānyad varivo yātave 'kaḥ,"One car-wheel of the Sun thou rolledst forward, and one thou settest free to move for Kutsa.",प्रान्यच्चक्रमवृहः सूर्यस्य कुत्सायान्यद्वरिवो यातवेऽकः,5-29-10,pra | anyat | cakram | avr̥haḥ | sūryasya | kutsāya | anyat | varivaḥ | yātave | akarityakaḥ || anāsaḥ | dasyūn | amr̥ṇaḥ | vadhena | ni | duryoṇe | avr̥ṇak | mr̥dhra-vācaḥ ||5.29.10||,
5,29,10,b,5-29-10-B,anāso dasyūm̐r amṛṇo vadhena ni duryoṇa āvṛṇaṅ mṛdhravācaḥ,"Thou slewest noseless Dasyus with thy weapon, and in their home o'erthrewest hostile speakers.",अनासो दस्यूँरमृणो वधेन नि दुर्योण आवृणङ्मृध्रवाचः,5-29-10,pra | anyat | cakram | avr̥haḥ | sūryasya | kutsāya | anyat | varivaḥ | yātave | akarityakaḥ || anāsaḥ | dasyūn | amr̥ṇaḥ | vadhena | ni | duryoṇe | avr̥ṇak | mr̥dhra-vācaḥ ||5.29.10||,
5,29,11,a,5-29-11-A,stomāsas tvā gaurivīter avardhann arandhayo vaidathināya piprum,"The lauds of Gauriviti made thee mighty to Vidathin's son, as prey, thou gavest Pipru.",स्तोमासस्त्वा गौरिवीतेरवर्धन्नरन्धयो वैदथिनाय पिप्रुम्,5-29-11,stomāsaḥ | tvā | gauri-vīteḥ | avardhan | arandhayaḥ | vaidathināya | piprum || ā | tvām | r̥jiśvā | sakhyāya | cakre | pacan | paktīḥ | apibaḥ | somam | asya ||5.29.11||,
5,29,11,b,5-29-11-B,ā tvām ṛjiśvā sakhyāya cakre pacan paktīr apibaḥ somam asya,"Rjisivan drew thee into friendship dressing the sacred food, and thou hast drunk his Soma.",आ त्वामृजिश्वा सख्याय चक्रे पचन्पक्तीरपिबः सोममस्य,5-29-11,stomāsaḥ | tvā | gauri-vīteḥ | avardhan | arandhayaḥ | vaidathināya | piprum || ā | tvām | r̥jiśvā | sakhyāya | cakre | pacan | paktīḥ | apibaḥ | somam | asya ||5.29.11||,
5,29,12,a,5-29-12-A,navagvāsaḥ sutasomāsa indraṁ daśagvāso abhy arcanty arkaiḥ,Navagvas and Dasgvas with libations of Soma juice sing hymns of praise to Indra.,नवग्वासः सुतसोमास इन्द्रं दशग्वासो अभ्यर्चन्त्यर्कैः,5-29-12,nava-gvāsaḥ | suta-somāsaḥ | indram | daśa-gvāsaḥ | abhi | arcanti | arkaiḥ || gavyam | cit | ūrvam | apidhāna-vantam | tam | cit | naraḥ | śaśamānāḥ | apa | vran ||5.29.12||,
5,29,12,b,5-29-12-B,gavyaṁ cid ūrvam apidhānavantaṁ taṁ cin naraḥ śaśamānā apa vran,Labouring at their task the men laid open the stall of Kine though firmly closed and fastened.,गव्यं चिदूर्वमपिधानवन्तं तं चिन्नरः शशमाना अप व्रन्,5-29-12,nava-gvāsaḥ | suta-somāsaḥ | indram | daśa-gvāsaḥ | abhi | arcanti | arkaiḥ || gavyam | cit | ūrvam | apidhāna-vantam | tam | cit | naraḥ | śaśamānāḥ | apa | vran ||5.29.12||,
5,29,13,a,5-29-13-A,katho nu te pari carāṇi vidvān vīryā maghavan yā cakartha,"How shall I serve thee, Maghavan, though knowing full well what hero deeds thou hast accomplished?",कथो नु ते परि चराणि विद्वान्वीर्या मघवन्या चकर्थ,5-29-13,katho iti | nu | te | pari | carāṇi | vidvān | vīryā | magha-van | yā | cakartha || yā | co iti | nu | navyā | kr̥ṇavaḥ | śaviṣṭha | pra | it | ūm̐ iti | tā | te | vidatheṣu | bravāma ||5.29.13||,
5,29,13,b,5-29-13-B,yā co nu navyā kṛṇavaḥ śaviṣṭha pred u tā te vidatheṣu bravāma,"And the fresh deeds which thou wilt do, Most Mighty! these, too, will we tell forth in sacred synods.",या चो नु नव्या कृणवः शविष्ठ प्रेदु ता ते विदथेषु ब्रवाम,5-29-13,katho iti | nu | te | pari | carāṇi | vidvān | vīryā | magha-van | yā | cakartha || yā | co iti | nu | navyā | kr̥ṇavaḥ | śaviṣṭha | pra | it | ūm̐ iti | tā | te | vidatheṣu | bravāma ||5.29.13||,
5,29,14,a,5-29-14-A,etā viśvā cakṛvām̐ indra bhūry aparīto januṣā vīryeṇa,"Resistless from of old through hero courage, thou hast done all these many acts, O Indra.",एता विश्वा चकृवाँ इन्द्र भूर्यपरीतो जनुषा वीर्येण,5-29-14,etā | viśvā | cakr̥-vān | indra | bhūri | apari-itaḥ | januṣā | vīryeṇa || yā | cit | nu | vajrin | kr̥ṇavaḥ | dadhr̥ṣvān | na | te | vartā | taviṣyāḥ | asti | tasyāḥ ||5.29.14||,
5,29,14,b,5-29-14-B,yā cin nu vajrin kṛṇavo dadhṛṣvān na te vartā taviṣyā asti tasyāḥ,"What thou wilt do in bravery, Thunder-wielder! none is there who may hinder this thy prowess.",या चिन्नु वज्रिन्कृणवो दधृष्वान्न ते वर्ता तविष्या अस्ति तस्याः,5-29-14,etā | viśvā | cakr̥-vān | indra | bhūri | apari-itaḥ | januṣā | vīryeṇa || yā | cit | nu | vajrin | kr̥ṇavaḥ | dadhr̥ṣvān | na | te | vartā | taviṣyāḥ | asti | tasyāḥ ||5.29.14||,
5,29,15,a,5-29-15-A,indra brahma kriyamāṇā juṣasva yā te śaviṣṭha navyā akarma,"Indra, accept the prayers which now are offered, accept the new prayers, Mightiest! which we utter.",इन्द्र ब्रह्म क्रियमाणा जुषस्व या ते शविष्ठ नव्या अकर्म,5-29-15,indra | brahma | kriyamāṇā | juṣasva | yā | te | śaviṣṭha | navyāḥ | akarma || vastrā-iva | bhadrā | su-kr̥tā | vasu-yuḥ | ratham | na | dhīraḥ | su-apāḥ | atakṣam ||5.29.15||,
5,29,15,b,5-29-15-B,vastreva bhadrā sukṛtā vasūyū rathaṁ na dhīraḥ svapā atakṣam,"Like fair and well-made robes, I, seeking riches, as a deft craftsman makes a car, have wrought them.",वस्त्रेव भद्रा सुकृता वसूयू रथं न धीरः स्वपा अतक्षम्,5-29-15,indra | brahma | kriyamāṇā | juṣasva | yā | te | śaviṣṭha | navyāḥ | akarma || vastrā-iva | bhadrā | su-kr̥tā | vasu-yuḥ | ratham | na | dhīraḥ | su-apāḥ | atakṣam ||5.29.15||,
5,30,1,a,5-30-1-A,kva sya vīraḥ ko apaśyad indraṁ sukharatham īyamānaṁ haribhyām,"WHERE is that Hero? Who hath looked on Indra borne on light-rolling car by Tawny Coursers,",क्व स्य वीरः को अपश्यदिन्द्रं सुखरथमीयमानं हरिभ्याम्,5-30-1,kva | syaḥ | vīraḥ | kaḥ | apaśyat | indram | sukha-ratham | īyamānam | hari-bhyām || yaḥ | rāyā | vajrī | suta-somam | icchan | tat | okaḥ | gantā | puru-hūtaḥ | ūtī ||5.30.1||,
5,30,1,b,5-30-1-B,yo rāyā vajrī sutasomam icchan tad oko gantā puruhūta ūtī,"Who, Thunderer, seeks with wealth the Soma-presser, and to his house goes, much-invoked, to aid him?",यो राया वज्री सुतसोममिच्छन्तदोको गन्ता पुरुहूत ऊती,5-30-1,kva | syaḥ | vīraḥ | kaḥ | apaśyat | indram | sukha-ratham | īyamānam | hari-bhyām || yaḥ | rāyā | vajrī | suta-somam | icchan | tat | okaḥ | gantā | puru-hūtaḥ | ūtī ||5.30.1||,
5,30,2,a,5-30-2-A,avācacakṣam padam asya sasvar ugraṁ nidhātur anv āyam icchan,"I have beheld his strong and secret dwelling, longing have sought the Founder's habitation.",अवाचचक्षं पदमस्य सस्वरुग्रं निधातुरन्वायमिच्छन्,5-30-2,ava | acacakṣam | padam | asya | sasvaḥ | ugram | ni-dhātuḥ | anu | āyam | icchan || apr̥ccham | anyān | uta | te | me | āhuḥ | indram | naraḥ | bubudhānāḥ | aśema ||5.30.2||,
5,30,2,b,5-30-2-B,apṛccham anyām̐ uta te ma āhur indraṁ naro bubudhānā aśema,"I asked of others, and they said in answer, May we, awakened men, attain to Indra.",अपृच्छमन्याँ उत ते म आहुरिन्द्रं नरो बुबुधाना अशेम,5-30-2,ava | acacakṣam | padam | asya | sasvaḥ | ugram | ni-dhātuḥ | anu | āyam | icchan || apr̥ccham | anyān | uta | te | me | āhuḥ | indram | naraḥ | bubudhānāḥ | aśema ||5.30.2||,
5,30,3,a,5-30-3-A,pra nu vayaṁ sute yā te kṛtānīndra bravāma yāni no jujoṣaḥ,"We will tell, Indra, when we pour libation, what mighty deeds thou hast performed to please us.",प्र नु वयं सुते या ते कृतानीन्द्र ब्रवाम यानि नो जुजोषः,5-30-3,pra | nu | vayam | sute | yā | te | kr̥tāni | indra | bravāma | yāni | naḥ | jujoṣaḥ || vedat | avidvān | śr̥ṇavat | ca | vidvān | vahate | ayam | magha-vā | sarva-senaḥ ||5.30.3||,
5,30,3,b,5-30-3-B,vedad avidvāñ chṛṇavac ca vidvān vahate 'yam maghavā sarvasenaḥ,"Let him who knows not learn, who knows them listen: hither rides Maghavan with all his army.",वेददविद्वाञ्छृणवच्च विद्वान्वहतेऽयं मघवा सर्वसेनः,5-30-3,pra | nu | vayam | sute | yā | te | kr̥tāni | indra | bravāma | yāni | naḥ | jujoṣaḥ || vedat | avidvān | śr̥ṇavat | ca | vidvān | vahate | ayam | magha-vā | sarva-senaḥ ||5.30.3||,
5,30,4,a,5-30-4-A,sthiram manaś cakṛṣe jāta indra veṣīd eko yudhaye bhūyasaś cit,"Indra, when born, thou madest firm thy spirit: alone thou seekest war to fight with many.",स्थिरं मनश्चकृषे जात इन्द्र वेषीदेको युधये भूयसश्चित्,5-30-4,sthiram | manaḥ | cakr̥ṣe | jātaḥ | indra | veṣi | it | ekaḥ | yudhaye | bhūyasaḥ | cit || aśmānam | cit | śavasā | didyutaḥ | vi | vidaḥ | gavām | ūrvam | usriyāṇām ||5.30.4||,
5,30,4,b,5-30-4-B,aśmānaṁ cic chavasā didyuto vi vido gavām ūrvam usriyāṇām,"With might thou clavest e'en the rock asunder, and foundest out the stable of the Milch-kine.",अश्मानं चिच्छवसा दिद्युतो वि विदो गवामूर्वमुस्रियाणाम्,5-30-4,sthiram | manaḥ | cakr̥ṣe | jātaḥ | indra | veṣi | it | ekaḥ | yudhaye | bhūyasaḥ | cit || aśmānam | cit | śavasā | didyutaḥ | vi | vidaḥ | gavām | ūrvam | usriyāṇām ||5.30.4||,
5,30,5,a,5-30-5-A,paro yat tvam parama ājaniṣṭhāḥ parāvati śrutyaṁ nāma bibhrat,"When thou wast born supremest at a distance, bearing a name renowned in far-off regions,",परो यत्त्वं परम आजनिष्ठाः परावति श्रुत्यं नाम बिभ्रत्,5-30-5,paraḥ | yat | tvam | paramaḥ | ā-janiṣṭhāḥ | parā-vati | śrutyam | nāma | bibhrat || ataḥ | cit | indrāt | abhayanta | devāḥ | viśvāḥ | apaḥ | ajayat | dāsa-patnīḥ ||5.30.5||,
5,30,5,b,5-30-5-B,ataś cid indrād abhayanta devā viśvā apo ajayad dāsapatnīḥ,Since then e'en Gods have been afraid of Indra: he conquered all the floods which served the Dasa.,अतश्चिदिन्द्रादभयन्त देवा विश्वा अपो अजयद्दासपत्नीः,5-30-5,paraḥ | yat | tvam | paramaḥ | ā-janiṣṭhāḥ | parā-vati | śrutyam | nāma | bibhrat || ataḥ | cit | indrāt | abhayanta | devāḥ | viśvāḥ | apaḥ | ajayat | dāsa-patnīḥ ||5.30.5||,
5,30,6,a,5-30-6-A,tubhyed ete marutaḥ suśevā arcanty arkaṁ sunvanty andhaḥ,"These blissful Maruts sing their psalm to praise thee, and pour to thee libation of the Soma.",तुभ्येदेते मरुतः सुशेवा अर्चन्त्यर्कं सुन्वन्त्यन्धः,5-30-6,tubhya | it | ete | marutaḥ | su-śevāḥ | arcanti | arkam | sunvanti | andhaḥ || ahim | ohānam | apaḥ | ā-śayānam | pra | māyābhiḥ | māyinam | sakṣat | indraḥ ||5.30.6||,
5,30,6,b,5-30-6-B,ahim ohānam apa āśayānam pra māyābhir māyinaṁ sakṣad indraḥ,"Indra with wondrous powers subdued the Dragon, the guileful lurker who beset the waters.",अहिमोहानमप आशयानं प्र मायाभिर्मायिनं सक्षदिन्द्रः,5-30-6,tubhya | it | ete | marutaḥ | su-śevāḥ | arcanti | arkam | sunvanti | andhaḥ || ahim | ohānam | apaḥ | ā-śayānam | pra | māyābhiḥ | māyinam | sakṣat | indraḥ ||5.30.6||,
5,30,7,a,5-30-7-A,vi ṣū mṛdho januṣā dānam invann ahan gavā maghavan saṁcakānaḥ,"Thou, Maghavan, from the first didst scatter foemen, speeding, while joying in the milk, the Giver.",वि षू मृधो जनुषा दानमिन्वन्नहन्गवा मघवन्संचकानः,5-30-7,vi | su | mr̥dhaḥ | januṣā | dānam | invan | ahan | gavā | magha-van | sam-cakānaḥ || atra | dāsasya | namuceḥ | śiraḥ | yat | avartayaḥ | manave | gātum | icchan ||5.30.7||,
5,30,7,b,5-30-7-B,atrā dāsasya namuceḥ śiro yad avartayo manave gātum icchan,"There, seeking man's prosperity, thou torest away the head of Namuci the Dasa.",अत्रा दासस्य नमुचेः शिरो यदवर्तयो मनवे गातुमिच्छन्,5-30-7,vi | su | mr̥dhaḥ | januṣā | dānam | invan | ahan | gavā | magha-van | sam-cakānaḥ || atra | dāsasya | namuceḥ | śiraḥ | yat | avartayaḥ | manave | gātum | icchan ||5.30.7||,
5,30,8,a,5-30-8-A,yujaṁ hi mām akṛthā ād id indra śiro dāsasya namucer mathāyan,"Pounding the head of Namuci the Dasa, me, too thou madest thine associate, Indra!",युजं हि मामकृथा आदिदिन्द्र शिरो दासस्य नमुचेर्मथायन्,5-30-8,yujam | hi | mām | akr̥thāḥ | āt | it | indra | śiraḥ | dāsasya | namuceḥ | mathāyan || aśmānam | cit | svaryam | vartamānam | pra | cakriyā-iva | rodasī iti | marut-bhyaḥ ||5.30.8||,
5,30,8,b,5-30-8-B,aśmānaṁ cit svaryaṁ vartamānam pra cakriyeva rodasī marudbhyaḥ,"Yea, and the rolling stone that is in heaven both worlds, as on a car, brought to the Maruts.",अश्मानं चित्स्वर्यं वर्तमानं प्र चक्रियेव रोदसी मरुद्भ्यः,5-30-8,yujam | hi | mām | akr̥thāḥ | āt | it | indra | śiraḥ | dāsasya | namuceḥ | mathāyan || aśmānam | cit | svaryam | vartamānam | pra | cakriyā-iva | rodasī iti | marut-bhyaḥ ||5.30.8||,
5,30,9,a,5-30-9-A,striyo hi dāsa āyudhāni cakre kim mā karann abalā asya senāḥ,"Women for weapons hath the Dasa taken, What injury can his feeble armies To me?",स्त्रियो हि दास आयुधानि चक्रे किं मा करन्नबला अस्य सेनाः,5-30-9,striyaḥ | hi | dāsaḥ | āyudhāni | cakre | kim | mā | karan | abalāḥ | asya | senāḥ || antaḥ | hi | akhyat | ubhe iti | asya | dhene iti | atha | upa | pra | ait | yudhaye | dasyum | indraḥ ||5.30.9||,
5,30,9,b,5-30-9-B,antar hy akhyad ubhe asya dhene athopa praid yudhaye dasyum indraḥ,"Well he distinguished his two different voices, and Indra then advanced to fight the Dasyu.",अन्तर्ह्यख्यदुभे अस्य धेने अथोप प्रैद्युधये दस्युमिन्द्रः,5-30-9,striyaḥ | hi | dāsaḥ | āyudhāni | cakre | kim | mā | karan | abalāḥ | asya | senāḥ || antaḥ | hi | akhyat | ubhe iti | asya | dhene iti | atha | upa | pra | ait | yudhaye | dasyum | indraḥ ||5.30.9||,
5,30,10,a,5-30-10-A,sam atra gāvo 'bhito 'navanteheha vatsair viyutā yad āsan,"Divided from their calves the Cows went lowing around, on every side, hither and thither.",समत्र गावोऽभितोऽनवन्तेहेह वत्सैर्वियुता यदासन्,5-30-10,sam | atra | gāvaḥ | abhitaḥ | anavanta | iha-iha | vatsaiḥ | vi-yutāḥ | yat | āsan || sam | tāḥ | indraḥ | asr̥jat | asya | śākaiḥ | yat | īm | somāsaḥ | su-sutāḥ | amandan ||5.30.10||,
5,30,10,b,5-30-10-B,saṁ tā indro asṛjad asya śākair yad īṁ somāsaḥ suṣutā amandan,"These Indra re-united with his helpers, what time the well-pressed Soma made him joyful.",सं ता इन्द्रो असृजदस्य शाकैर्यदीं सोमासः सुषुता अमन्दन्,5-30-10,sam | atra | gāvaḥ | abhitaḥ | anavanta | iha-iha | vatsaiḥ | vi-yutāḥ | yat | āsan || sam | tāḥ | indraḥ | asr̥jat | asya | śākaiḥ | yat | īm | somāsaḥ | su-sutāḥ | amandan ||5.30.10||,
5,30,11,a,5-30-11-A,yad īṁ somā babhrudhūtā amandann aroravīd vṛṣabhaḥ sādaneṣu,"What time the Somas mixed by Babhru cheered him, loud the Steer bellowed in his habitations.",यदीं सोमा बभ्रुधूता अमन्दन्नरोरवीद्वृषभः सादनेषु,5-30-11,yat | īm | somāḥ | babhru-dhūtāḥ | amandan | aroravīt | vr̥ṣabhaḥ | sādaneṣu || puram-daraḥ | papi-vān | indraḥ | asya | punaḥ | gavām | adadāt | usriyāṇām ||5.30.11||,
5,30,11,b,5-30-11-B,puraṁdaraḥ papivām̐ indro asya punar gavām adadād usriyāṇām,"So Indra drank thereof, the Fort-destroyer, and gave him guerdon, in return, of milch-kine.",पुरंदरः पपिवाँ इन्द्रो अस्य पुनर्गवामददादुस्रियाणाम्,5-30-11,yat | īm | somāḥ | babhru-dhūtāḥ | amandan | aroravīt | vr̥ṣabhaḥ | sādaneṣu || puram-daraḥ | papi-vān | indraḥ | asya | punaḥ | gavām | adadāt | usriyāṇām ||5.30.11||,
5,30,12,a,5-30-12-A,bhadram idaṁ ruśamā agne akran gavāṁ catvāri dadataḥ sahasrā,"This good deed have the Rusamas done, Agni! that they have granted me four thousand cattle.",भद्रमिदं रुशमा अग्ने अक्रन्गवां चत्वारि ददतः सहस्रा,5-30-12,bhadram | idam | ruśamāḥ | agne | akran | gavām | catvāri | dadataḥ | sahasrā || r̥ṇam-cayasya | pra-yatā | maghāni | prati | agrabhīṣma | nr̥-tamasya | nr̥ṇām ||5.30.12||,
5,30,12,b,5-30-12-B,ṛṇaṁcayasya prayatā maghāni praty agrabhīṣma nṛtamasya nṛṇām,"We have received Rnancaya's wealth, of heroes the most heroic, which was freely offered.",ऋणंचयस्य प्रयता मघानि प्रत्यग्रभीष्म नृतमस्य नृणाम्,5-30-12,bhadram | idam | ruśamāḥ | agne | akran | gavām | catvāri | dadataḥ | sahasrā || r̥ṇam-cayasya | pra-yatā | maghāni | prati | agrabhīṣma | nr̥-tamasya | nr̥ṇām ||5.30.12||,
5,30,13,a,5-30-13-A,supeśasam māva sṛjanty astaṁ gavāṁ sahasrai ruśamāso agne,"The Rusamas, O Agni, sent me homeward with fair adornment and with kine in thousands.",सुपेशसं माव सृजन्त्यस्तं गवां सहस्रै रुशमासो अग्ने,5-30-13,su-peśasam | mā | ava | sr̥janti | astam | gavām | sahasraiḥ | ruśamāsaḥ | agne || tīvrāḥ | indram | amamanduḥ | sutāsaḥ | aktoḥ | vi-uṣṭau | pari-takmyāyāḥ ||5.30.13||,
